<?xml version="1.0" encoding="utf-8"?>
<Content xmlns:xsi="http://www.w3.org/2001/XMLSchema-instance"
         xmlns="http://tempuri.org/Language.xsd"
         xsi:schemaLocation="http://tempuri.org/Language.xsd Language.xsd">

	<Buttons>
		<JoinGame>Rejoindre</JoinGame>
		<Settings>Paramètres</Settings>
		<Authors>Auteurs</Authors>
		<Exit>Quitter</Exit>
		<Back>Retour</Back>
	</Buttons>

	<Labels>
		<Language>Langue</Language>
		<Resolution>Résolution</Resolution>
		<DisplayMode>Mode d'affichage</DisplayMode>
		<DisplayModeWindowed>Fenêtré</DisplayModeWindowed>
		<DisplayModeFullScreen>Plein écran</DisplayModeFullScreen>
		<DisplayModeBorderless>Sans bordure</DisplayModeBorderless>
	</Labels>

	<Other>
	</Other>

</Content>
