<?xml version="1.0" encoding="utf-8"?>
<Content xmlns:xsi="http://www.w3.org/2001/XMLSchema-instance"
         xmlns="http://tempuri.org/Language.xsd"
         xsi:schemaLocation="http://tempuri.org/Language.xsd Language.xsd">

	<Buttons>
		<JoinGame>Join</JoinGame>
		<Settings>Settings</Settings>
		<Authors>Authors</Authors>
		<Exit>Exit</Exit>
		<Back>Back</Back>
	</Buttons>

	<Labels>
		<Language>Language</Language>
		<Resolution>Resolution</Resolution>
		<DisplayMode>Screen type</DisplayMode>
		<DisplayModeWindowed>Windowed</DisplayModeWindowed>
		<DisplayModeFullScreen>Fullscreen</DisplayModeFullScreen>
		<DisplayModeBorderless>Borderless</DisplayModeBorderless>
	</Labels>

	<Other>
	</Other>

</Content>